date_ajout,statut,titre,quartier,adresse,prix,superficie_pi2,chambres,balcon,station_metro,ligne_metro,minutes_a_pied,site,lien,score,notes,photo
2026-07-13,NOUVEAU,"Condo 3 chambres, 1100 pi², 2 balcons – Centre-Sud, près métro Frontenac",Centre-Sud,"2553 Avenue Gascon, Montréal, QC H2K 2W5",2090,1100,3,oui,Frontenac,verte,8 (estimé),Kijiji,https://www.kijiji.ca/v-apartments-condos/ville-de-montreal/condo-1100pc-3ch-pres-metro-et-plateau/1740479448,10,"3 chambres fermées + bureau, 2 balcons, planchers bois franc, grande fenestration, animaux acceptés, dispo 1er août 2026, bail 1 an, secteur vivant à la frontière Plateau/Hochelaga (rue Ontario), aucun stationnement inclus",https://media.kijiji.ca/api/v1/ca-prod-fsbo-ads/images/6c/6c93d656-ed7d-413a-ac8b-986e4f7f2eda?rule=kijijica-960-jpg
2026-07-13,NOUVEAU,"4 1/2 (2 chambres), 900 pi², balcon, tout inclus – Rosemont (rue Dandurand)",Rosemont-La Petite-Patrie,"3320 Rue Dandurand, Montréal, QC H1X 1M6",1999,900,2,oui,Iberville,bleue,5 (estimé),Kijiji,https://www.kijiji.ca/v-apartments-condos/ville-de-montreal/condo-a-louer-2-chambres-rosemont-petite-patrie-tout-inclus/1739170766,7,"Construit 2012, tout inclus (chauffage, hydro, eau, wifi, climatisation), semi-meublé (électros + meubles salon/cuisine, matelas non inclus), animaux limités, dispo 1er juillet 2026, à 5-10 min à pied des commerces/restos de la rue Masson",https://media.kijiji.ca/api/v1/ca-prod-fsbo-ads/images/ba/bacee7d5-1abf-4a36-80b6-12877aa40971?rule=kijijica-960-jpg
2026-07-12,vu,6 et demi avec cour arrière privative - Villeray - 1er juillet!,Villeray,"8413 rue Saint-Hubert, Montréal, QC H2P 1Z6",1950,1200,3,oui,Jarry,orange,10,Kijiji,https://www.kijiji.ca/v-apartments-condos/ville-de-montreal/6-et-demi-avec-cour-arriere-privative-villeray-1er-juillet/1734943312,9,"Dispo 1er juillet 2026, prix promo 12 mois (régulier 2050$), RDC + sous-sol aménagé, cour arrière privée, lave-vaisselle inclus, option 4 électros +100$/mois, 1 chat ou petit chien accepté",https://media.kijiji.ca/api/v1/ca-prod-dealer-ads/images/8a/8a62cfb1-09e6-4e8b-bc96-fe68a77e35b2?rule=kijijica-960-jpg
2026-07-12,vu,Beau 6 1/2 ensoleillé - proche metro - Hochelaga,Hochelaga-Maisonneuve,"Montréal, QC H1W 1M3",2100,900,4,oui,Joliette,verte,2,Kijiji,https://www.kijiji.ca/v-apartments-condos/ville-de-montreal/beau-6-1-2-ensoleille-proche-metro-hochelaga/1738000997,9,"Dispo 1er juin 2026, eau incluse, 4 électros inclus (frigo cuisinière laveuse sécheuse), 2e étage, plafonds hauts, animaux limités, près Promenade Ontario",https://media.kijiji.ca/api/v1/ca-prod-fsbo-ads/images/77/77a71464-4b91-4435-bf29-e86a1a84a6a8?rule=kijijica-960-jpg
2026-07-12,vu,"Grand 6 1/2 Villeray, metro Jarry",Villeray,"Montréal, QC H2R 2E8",2400,1250,3,oui,Jarry,orange,3,Kijiji,https://www.kijiji.ca/v-apartments-condos/ville-de-montreal/grand-6-1-2-villeray-metro-jarry/1740222569,9,"Dispo 1er août 2026 (ou 1er juillet), 2 balcons (avant + grand arrière), 3 chambres fermées, électros non inclus mais négociable, pas d'animaux, non-fumeur, chauffage/électricité aux frais du locataire",https://media.kijiji.ca/api/v1/ca-prod-fsbo-ads/images/41/41b6a01a-67b3-4d74-8966-ac23a1a991aa?rule=kijijica-960-jpg
2026-07-12,vu,"4 1/2 rénové, grand balcon, près métro Joliette/Pie-IX",Hochelaga-Maisonneuve,"1695 Avenue Bourbonnière, Montréal",1940,900,2,oui,Joliette/Pie-IX,verte,5,DuProprio,https://duproprio.com/fr/location/montreal/mercier-hochelaga-maisonneuve/4-1-2-a-louer/hab-1695-avenue-bourbonniere-1135855,8,"2 ch fermées (1 grande chambre double) + salle d'eau, grand balcon arrière sur jardin paisible, dispo 1er août 2026 (ou 18 juillet), à 1 min du Metro épicerie, 3 min boulangerie Arhoma, Promenade Ontario et Place Simon-Valois à pied",https://photos.duproprio.com/photos/public/for_rent/202606/1135855/mercier-hochelaga-maisonneuve-600-15749477.jpg
2026-07-12,vu,"5 1/2 balcon, 1200 pi² – Rosemont",Rosemont-La Petite-Patrie,"6885 43e Avenue, Montréal, QC H1T 2R9",1900,1200,3,oui,Mary Two-Axe Earley (à vérifier),n/d,12,Kijiji,https://www.kijiji.ca/v-apartments-condos/ville-de-montreal/3-bedroom-apartment-for-rent-in-rosemont/1739297378,8,"Animaux permis, eau chaude incluse, électricité et internet à la charge du locataire, libre 16 juin 2026, nom de station à vérifier",https://media.kijiji.ca/api/v1/ca-prod-fsbo-ads/images/2e/2efd08ab-2014-42f0-bde7-3afc97ccb893?rule=kijijica-960-jpg
2026-07-12,vu,"5 1/2 style condo, 2 balcons – Rosemont (Promenade Masson)",Rosemont-La Petite-Patrie,"n/d (Montréal, QC H1Y 1Y3, secteur Promenade Masson)",1925,1100,3,oui,Laurier,orange,n/d (bus ~20 min),Kijiji,https://www.kijiji.ca/v-apartments-condos/ville-de-montreal/cessation-de-bail-5-style-condo-promenade-masson-rosemont/1739478440,8,"Chiens et chats acceptés, chauffage non inclus, Walk Score 99, très proche des commerces de la Promenade Masson",https://media.kijiji.ca/api/v1/ca-prod-fsbo-ads/images/21/219d597c-7a1f-471a-9c6c-a7768c42324c?rule=kijijica-960-jpg
2026-07-12,vu,"5 1/2, 1000 pi², balcon – Rosemont/Beaubien",Rosemont-La Petite-Patrie,"Rue de Normanville, Montréal, QC H2S 2B5",1980,1000,3,oui,Rosemont/Beaubien,orange,10 (estimé),Kijiji,https://www.kijiji.ca/v-apartments-condos/ville-de-montreal/appart-5-1-2-a-louer-3-bed-apartment-for-rent-la-petite-patrie/1740477077,8,"1 mois gratuit 1ère année (régulier 2160$), animaux non acceptés, près du parc Père-Marquette, libre 12 juillet 2026",
2026-07-12,vu,"Appartement 3 chambres, jardin, parking, Hochelaga",Hochelaga-Maisonneuve,"Montréal, QC H1W 3A8",2135,1200,3,n/d,Joliette,verte,4,Kijiji,https://www.kijiji.ca/v-apartments-condos/ville-de-montreal/appartement-3-chambres-jardin-parking-hochelaga/1739953364,8,"Cession de bail jusqu'au 1er juillet 2027, dispo 1er sept 2026, cour privée, stationnement, rangement au sous-sol, lave-vaisselle inclus, animaux limités, enquête de crédit",https://media.kijiji.ca/api/v1/ca-prod-fsbo-ads/images/43/4348c9c2-4f70-41ce-a65d-9ed5490935cd?rule=kijijica-960-jpg
2026-07-12,vu,5½ meublé tout inclus à 3 min du métro Joliette,Hochelaga-Maisonneuve,"3602 rue de Rouen, Montréal",2150,900,2,oui,Joliette,verte,4,LogisQuébec,https://www.logisquebec.com/appartement-a-louer-mercier_hochelaga-maisonneuve-l353091,8,"5½ 900 pi² meublé, chauffé, wifi et tout inclus, grande terrasse arrière 100 pi², métro Joliette à 287 m, disponible 11 octobre 2026, bail min 3 mois, pas d'animaux",
2026-07-12,vu,5 1/2 + annexe rénové près du métro Beaubien,La Petite-Patrie,"secteur métro Beaubien, H2S 2J5",2200,1064,3,oui,Beaubien,orange,5,Kijiji,https://www.kijiji.ca/v-apartments-condos/ville-de-montreal/5-1-2-annexe-renove-pres-du-metro-beaubien/1735720589,8,"3 ch fermées + annexe (ancien solarium), rénové récemment, 2 grands balcons, entrées laveuse-sécheuse et lave-vaisselle, climatisation, dispo 1er sept 2026, rue Beaubien et commerces à pied, non-fumeur, pas d'animaux",https://media.kijiji.ca/api/v1/ca-prod-fsbo-ads/images/ca/ca9a1937-a625-413b-ba4b-233b3a0e900b?rule=kijijica-960-jpg
2026-07-12,vu,Magnifique 5 1/2 sur le plateau mont-royal,Le Plateau-Mont-Royal,"rue Marie-Anne, H2H 1M9",2300,1000,3,oui,Mont-Royal,orange,12,Kijiji,https://www.kijiji.ca/v-apartments-condos/ville-de-montreal/magnifique-5-1-2-sur-le-plateau-mont-royal/1734803750,8,"3 ch fermées, cuisine rénovée comptoirs quartz, planchers bois franc d'origine, laveuse-sécheuse dans l'unité, balcon privé, animaux acceptés, bail au mois, avenue Mont-Royal et ses commerces à pied, chauffage/électricité en sus",https://media.kijiji.ca/api/v1/ca-prod-fsbo-ads/images/38/389e0d3d-7bcf-42a9-8fe4-8a27fa531359?rule=kijijica-960-jpg
2026-07-12,vu,Unité neuve 3 chambres 1120 pi2 projet boutique,Hochelaga-Maisonneuve,"2017, avenue Letourneux, app. 101, Montréal",2395,1120,3,non,Pie-IX,verte,11,Centris,https://www.centris.ca/fr/condo-appartement~a-louer~montreal-mercier-hochelaga-maisonneuve/27359064,8,"Construction neuve 2026, 6 pièces, 3 chambres en demi-sous-sol, terrasse commune sur le toit, semi-meublé, internet inclus, 1 mois gratuit bail 24 mois, dispo 1er juillet 2026",https://mspublic.centris.ca/media.ashx?id=ADDD250DA15A15CDDDDDDDDDD2&t=pi&w=1260&h=1024&sm=c
2026-07-12,vu,Plateau - Superbe 5 1/2 de 3 Chambres - Disponible le 1er Juillet,Le Plateau-Mont-Royal,"3477 rue Saint-Dominique, H2X 2X5",2400,1000,3,oui,Sherbrooke,orange,7,Kijiji,https://www.kijiji.ca/v-apartments-condos/ville-de-montreal/plateau-superbe-5-1-2-de-3-chambres-disponible-le-1er-juillet/1740256791,8,"3 ch fermées, 2e étage, laveuse-sécheuse dans l'unité, climatisation, balcon arrière, boul. Saint-Laurent et ses commerces à 1 rue, secteur sud du Plateau (limite Milton-Parc), métro Sherbrooke ou Saint-Laurent à pied, dispo 1er juillet 2026, animaux limités, prix à la limite haute du budget",https://media.kijiji.ca/api/v1/ca-prod-dealer-ads/images/8d/8d95567f-3a46-42b2-bcd6-c8ea29c0a1ff?rule=kijijica-960-jpg
2026-07-13,vu,"Appartement 2 chambres fermées, 974 pi², balcon – Plateau (Gilford/Chambord)",Le Plateau-Mont-Royal,"n/d (Montréal, QC H2J 3L2, coin Gilford/Chambord)",2195,974,2,oui,Mont-Royal ou Laurier,orange,10,Kijiji,https://www.kijiji.ca/v-apartments-condos/ville-de-montreal/appartement-2-chambre-plateau-mont-royal/1739725006,7,"Rez-de-jardin lumineux, sdb rénovée 2021, cuisine rénovée 2019, tous électros inclus + laveuse-sécheuse, à 2 min de l'avenue Mont-Royal, près parcs Lafontaine et Laurier, animaux limités, dispo 1er juillet ou août 2026",https://media.kijiji.ca/api/v1/ca-prod-fsbo-ads/images/83/83da6eb9-3422-4702-b436-ed820032998c?rule=kijijica-960-jpg
2026-07-12,vu,"5 1/2 lumineux, 2 chambres fermées, 2 balcons – Rosemont, près Cinéma Beaubien",Rosemont-La Petite-Patrie,"n/d (Montréal, QC H2G 2S1)",1950,946,2,oui,Beaubien,orange,8 (estimé),Kijiji,https://www.kijiji.ca/v-apartments-condos/ville-de-montreal/5-lumineux-2-ch-fermees-renove-rosemont-petite-patrie/1739560132,7,"Animaux limités, 3e étage, buanderie et lave-vaisselle inclus, à deux pas du Cinéma Beaubien, libre 1er juillet 2026",https://media.kijiji.ca/api/v1/ca-prod-fsbo-ads/images/c1/c15d7c88-4278-46b2-b504-86cd39d6404b?rule=kijijica-960-jpg
2026-07-12,vu,Appartement lumineux sur la plaza,La Petite-Patrie,"rue Saint-Hubert, H2S 2L9",1975,1000,2,oui,Beaubien,orange,2,Kijiji,https://www.kijiji.ca/v-apartments-condos/ville-de-montreal/appartement-lumineux-sur-la-plaza/1739853332,7,"2 ch fermées + boudoir avec grand placard, Plaza St-Hubert au pied de l'immeuble (quartier très vivant), laveuse-sécheuse dans l'unité, clim, 1 stationnement, grand balcon, métro Beaubien à 2 min selon l'annonce, dispo 15 juillet 2026, animaux limités",https://media.kijiji.ca/api/v1/ca-prod-fsbo-ads/images/29/29f42067-d07c-42c9-9127-b218f6f690f8?rule=kijijica-960-jpg
2026-07-12,vu,Condo 4½ rénové avec stationnement,Rosemont/La Petite-Patrie,"6855, rue d'Iberville, Montréal",2100,1010,2,oui,D'Iberville,bleue,8,DuProprio,https://duproprio.com/fr/location/montreal/rosemont-la-petite-patrie/4-1-2-a-louer/hab-6855-diberville-1136946,7,"2 chambres fermées, cuisine et sdb modernes, climatisé, stationnement, rangement ext., animaux acceptés, dispo 16 juillet 2026",https://photos.duproprio.com/photos/public/for_rent/202607/1136946/4-1-2-rosemont-petite-patrie-600-15776920.jpg
2026-07-12,vu,"6 1/2, balcon et terrasse, animaux acceptés – Hochelaga",Hochelaga-Maisonneuve,"1841 Rue Saint-Germain, Montréal",2195,n/d,3,oui,Préfontaine,verte,10,Centris,https://centris.ca/fr/condo-appartement~a-louer~montreal-mercier-hochelaga-maisonneuve/25697495,7,"Semi-meublé, animaux acceptés sous conditions (chiens ok), 1 stationnement, libre 7 jours après acceptation du bail, vérification de crédit requise",https://mspublic.centris.ca/media.ashx?id=ADDD250DA16F1EEDDDDDDDDDD4&t=pi&w=640&h=480&sm=c
2026-07-12,vu,"Cession de bail – Grand 5 1/2 lumineux, balcon et terrasse – Hochelaga/Préfontaine",Hochelaga-Maisonneuve,"n/d (Montréal, QC H1V 2X2, secteur Préfontaine)",2195,n/d,3,oui,Préfontaine,verte,10,Kijiji,https://www.kijiji.ca/v-apartments-condos/ville-de-montreal/cession-de-bail-grand-5-1-2-lumineux-hochelaga-prefontaine/1739376269,7,"1er mois gratuit, animaux acceptés (même chiens), hydro et stationnement inclus, buanderie, bail jusqu'en juin 2027",https://media.kijiji.ca/api/v1/ca-prod-fsbo-ads/images/9b/9b7ac581-3ab1-482b-9f87-d703dcb6bcc3?rule=kijijica-960-jpg
2026-07-12,vu,4 1/2 Villeray . Christophe-Colomb.,Villeray,"Jarry/Christophe-Colomb, Montréal, QC H2P 0C3",2305,1054,2,oui,Jarry,orange,10,Kijiji,https://www.kijiji.ca/v-apartments-condos/ville-de-montreal/4-1-2-villeray-christophe-colomb/1739980393,7,"Dispo 1er sept 2026, internet et clim inclus, tous électros inclus (four frigo lave-vaisselle laveuse-sécheuse), animaux acceptés, immeuble béton insonorisé avec gym/ascenseur/concierge, grand balcon-terrasse privé",https://media.kijiji.ca/api/v1/ca-prod-fsbo-ads/images/5d/5d7a6647-dba7-4661-87c0-6b86eeb875b6?rule=kijijica-960-jpg
2026-07-13,vu,"4 1/2 sur 2 étages, condo neuf « Joseph », balcon, près métro Joliette",Rosemont-La Petite-Patrie,"3420 boul. Saint-Joseph Est, Montréal, QC H1X 0A6",2150,n/d,2,oui,Joliette,verte,10 (estimé),Kijiji,https://www.kijiji.ca/v-apartments-condos/ville-de-montreal/4-5-sur-2-etages-condo-appartement-a-louer-rosemont-joseph/1727979165,6,"Condo neuf « Joseph » sur 2 étages, face au parc Lafond, eau chaude et climatisation incluses, électros neufs (laveuse-sécheuse inclus), piscine extérieure/gym/stationnement intérieur payant, animaux acceptés, superficie non précisée, près Stade olympique et Jardin botanique",https://media.kijiji.ca/api/v1/ca-prod-dealer-ads/images/2a/2a378c4c-30df-42fd-8c0d-515e4ee71bc4?rule=kijijica-960-jpg
2026-07-12,vu,"5 1/2 RDC rénové avec cour – Hochelaga, près Pie-IX",Hochelaga-Maisonneuve,"1711 Avenue d'Orléans, Montréal, QC H1W 3R4",1950,900,2,n/d,Pie-IX,verte,10 (estimé),Kijiji,https://www.kijiji.ca/v-apartments-condos/ville-de-montreal/hochelaga-superbe-5-1-2-renove-au-rez-de-chaussee-avec-cour/1740256793,6,"Animaux limités, stationnement inclus, cour arrière privée, climatisation, libre 1er juillet 2026",https://media.kijiji.ca/api/v1/ca-prod-dealer-ads/images/d0/d0d75179-15a9-4d6e-a66c-024195759d32?rule=kijijica-960-jpg
2026-07-12,vu,"5 1/2 avec garage, grande cour – Hochelaga (Place Valois)",Hochelaga-Maisonneuve,"n/d (Montréal, QC H1W 3N6, angle Bourbonnière/Ontario)",1950,950,2,n/d (grande cour arrière privée),Joliette,verte,9 (estimé),Kijiji,https://www.kijiji.ca/v-apartments-condos/ville-de-montreal/5-1-2-avec-garage-a-louer-dans-hochelaga-mainsonneuve/1739944242,6,"Chauffage et climatisation centrale inclus, chats seulement (pas de chiens), 2 places de stationnement + 1 garage, libre 1er août 2026, près Place Valois",https://media.kijiji.ca/api/v1/ca-prod-fsbo-ads/images/3e/3efd086c-a651-43a1-8291-a49f0c1d38d5?rule=kijijica-960-jpg
2026-07-12,vu,"Grand 5 1/2 lumineux, à 200m du métro Laurier – Plateau",Le Plateau-Mont-Royal,"n/d (Montréal, QC H2J 2Y3)",2000,1100,2,oui (petit balcon cuisine),Laurier,orange,3,Kijiji,https://www.kijiji.ca/v-apartments-condos/ville-de-montreal/grand-51-2-lumineux-sur-plateau-mont-royal/1738318103,6,"Chauffage inclus, animaux limités, walk-in dans chambre principale, libre 1er juillet 2026",https://media.kijiji.ca/api/v1/ca-prod-fsbo-ads/images/d0/d0ca9a85-dbf8-4673-a89d-264708952626?rule=kijijica-960-jpg
2026-07-12,vu,Grand 5½ meublé et entièrement rénové,Villeray,"13e Avenue, Montréal (près métro Saint-Michel)",2265,n/d,3,oui,Saint-Michel,bleue,5,LogisQuébec,https://www.logisquebec.com/appartement-a-louer-villeray_saint-michel_parc-extension-l353226,6,"5½ 3 chambres, meublé, laveuse-sécheuse, comptoirs quartz, balcon + terrasse, métro Saint-Michel à 394 m, cession de bail jusqu'au 30 juin 2027, pas d'animaux, limite est de Villeray",
2026-07-12,vu,5½ 2e étage Jarry Est rénové,Villeray,"582 rue Jarry Est, Montréal",2300,n/d,3,oui,Jarry,orange,2,LogisQuébec,https://www.logisquebec.com/appartement-a-louer-villeray_saint-michel_parc-extension-l353442,6,"5½ 3 chambres fermées, rénové, climatisation murale, balcons avant et arrière, métro Jarry à 103 m, disponible immédiatement, enquête de crédit exigée",
2026-07-12,vu,"5 1/2 rénové, stationnement, patio – Plateau",Le Plateau-Mont-Royal,"2181A Rue Marie-Anne, Montréal, QC H2H 1M9",1995,1100,2,oui (patio arrière),n/d,n/d,n/d,Kijiji,https://www.kijiji.ca/v-apartments-condos/ville-de-montreal/5-1-2-plateau-avec-stationnement-2-chambres-renove/1739130207,5,"Non chauffé, animaux limités, stationnement privé inclus, planchers bois franc, libre 15 juillet 2026",https://media.kijiji.ca/api/v1/ca-prod-fsbo-ads/images/2e/2e8a22d5-2d29-437c-bd2c-a9be0878ff77?rule=kijijica-960-jpg
2026-07-12,vu,5 1/2 Villeray - 2 chambres - près du métro Jarry - 2050$,Villeray,"Montréal, QC H2R",2050,1000,2,non,Jarry,orange,5,Kijiji,https://www.kijiji.ca/v-apartments-condos/ville-de-montreal/5-1-2-villeray-2-chambres-pres-du-metro-jarry-2050/1738384606,5,"Dispo 1er juin 2026, rénové, 2 chambres + bureau, thermopompe (chauffage/clim), 5 électros inclus, cour-patio arrière, planchers bois franc refaits, pas d'animaux",https://media.kijiji.ca/api/v1/ca-prod-fsbo-ads/images/cf/cf44ffec-5a1f-4ffd-81e0-2eb0cfc316d8?rule=kijijica-960-jpg
2026-07-12,vu,"5 1/2 rénové, 995 pi², près Promenade Masson – Rosemont",Rosemont-La Petite-Patrie,"5472 1ere Avenue, Montréal",2200,995,3,n/d,n/d,n/d,n/d,DuProprio,https://duproprio.com/fr/location/montreal/rosemont-la-petite-patrie/5-1-2-a-louer/hab-5472-1ere-avenue-882773,5,"Chauffage au plancher radiant, climatisation, cour privée avec remise, près Promenade Masson et parc Pélican, non-fumeurs",https://photos.duproprio.com/photos/public/for_rent/201911/882773/5-1-2-plateau-mont-royal-1600-10690669.jpg
2026-07-13,vu,"5 1/2, 3 chambres – Plateau (avenue de Lorimier)",Le Plateau-Mont-Royal,"4216 avenue de Lorimier, app. 204, Montréal",2150,n/d,3,n/d,Mont-Royal ou Papineau (à vérifier),orange,12 (estimé),DuProprio,https://duproprio.com/fr/location/montreal/le-plateau-mont-royal/5-1-2-a-louer/hab-204-4216-av-de-lorimier-1135328,4,"Semi-meublé, laveuse-sécheuse/cuisinière/frigo inclus, wifi inclus, 2e étage, petits animaux acceptés, dispo 1er juillet ou 1er sept 2026, balcon non précisé dans l'annonce, secteur commerçant (cafés, parcs) à pied",https://photos.duproprio.com/photos/public/for_rent/202606/1135328/5-1-2-plateau-mont-royal-600-15736059.jpg
2026-07-12,vu,"Grand 5 1/2, 3 chambres fermées – coeur du Plateau (rue Rachel Est)",Le Plateau-Mont-Royal,"62 rue Rachel Est, Montréal",2195,n/d,3,n/d,Sherbrooke ou Mont-Royal (à vérifier),orange,8 (estimé),DuProprio,https://duproprio.com/fr/location/montreal/le-plateau-mont-royal/5-1-2-a-louer/hab-5-12-62-rue-rachel-est-1132358,4,"Dernier étage, tranquille et lumineux, entrée laveuse-sécheuse, non-fumeur, chiens non acceptés, enquête de crédit requise, balcon et superficie non précisés dans l'annonce, secteur près Saint-Laurent/Saint-Denis",https://photos.duproprio.com/photos/public/for_rent/202605/1132358/5-1-2-plateau-mont-royal-1600-15661700.jpg
2026-07-12,vu,"5 1/2, 3 chambres, près métro Mont-Royal (rue de Bordeaux)",Le Plateau-Mont-Royal,"4275 Rue de Bordeaux, Montréal",2095,n/d,3,n/d,Mont-Royal,orange,10 (estimé),DuProprio,https://duproprio.com/fr/location/montreal/le-plateau-mont-royal/5-1-2-a-louer/hab-4275-bordeaux-1131937,4,"2e étage, dispo immédiatement, rien d'inclus (chauffage/électricité aux frais du locataire), à moins de 10 min du parc La Fontaine, proche avenue du Mont-Royal (commerces/cafés), balcon et superficie non précisés dans l'annonce",https://photos.duproprio.com/photos/public/for_rent/202605/1131937/plateau-mont-royal-600-15652873.jpg
2026-07-12,vu,"5 1/2 (avec sous-sol), 2 garages – Rosemont",Rosemont-La Petite-Patrie,"1889 Rue des Carrières, Montréal",2375,n/d,3,n/d,n/d,n/d,n/d,Centris,https://www.centris.ca/en/condos-apartments~for-rent~montreal-rosemont-la-petite-patrie/15047676,3,"Walk Score 94, 2 places de garage à 250$/mois chacune, rénovations récentes sous-sol et salle de bain, libre 5 jours après acceptation du bail",https://mspublic.centris.ca/media.ashx?id=ADDD250DE603764DDDDDDDDDDD&t=pi&w=1260&h=1024&sm=c
